[
  {
    "block": 0,
    "control_sha256": "7da89ea4bb10be9daaafde07a482782d650c91b1f817cd9f7b1b6f0706f2ca47",
    "elapsed_ms": 100,
    "label": "block",
    "masked_side": "x",
    "mode": "synthetic",
    "pair_id": "aa0_0",
    "pair_order": 0,
    "schema_version": "1.1",
    "side": "left",
    "target_id": "block"
  },
  {
    "block": 0,
    "control_sha256": "7da89ea4bb10be9daaafde07a482782d650c91b1f817cd9f7b1b6f0706f2ca47",
    "elapsed_ms": 100,
    "label": "block",
    "masked_side": "y",
    "mode": "synthetic",
    "pair_id": "aa0_0",
    "pair_order": 1,
    "schema_version": "1.1",
    "side": "right",
    "target_id": "block"
  },
  {
    "block": 1,
    "control_sha256": "7da89ea4bb10be9daaafde07a482782d650c91b1f817cd9f7b1b6f0706f2ca47",
    "elapsed_ms": 100,
    "label": "block",
    "masked_side": "y",
    "mode": "synthetic",
    "pair_id": "aa0_1",
    "pair_order": 0,
    "schema_version": "1.1",
    "side": "right",
    "target_id": "block"
  },
  {
    "block": 1,
    "control_sha256": "7da89ea4bb10be9daaafde07a482782d650c91b1f817cd9f7b1b6f0706f2ca47",
    "elapsed_ms": 100,
    "label": "block",
    "masked_side": "x",
    "mode": "synthetic",
    "pair_id": "aa0_1",
    "pair_order": 1,
    "schema_version": "1.1",
    "side": "left",
    "target_id": "block"
  },
  {
    "block": 2,
    "control_sha256": "7da89ea4bb10be9daaafde07a482782d650c91b1f817cd9f7b1b6f0706f2ca47",
    "elapsed_ms": 100,
    "label": "block",
    "masked_side": "x",
    "mode": "synthetic",
    "pair_id": "aa0_2",
    "pair_order": 0,
    "schema_version": "1.1",
    "side": "left",
    "target_id": "block"
  },
  {
    "block": 2,
    "control_sha256": "7da89ea4bb10be9daaafde07a482782d650c91b1f817cd9f7b1b6f0706f2ca47",
    "elapsed_ms": 100,
    "label": "block",
    "masked_side": "y",
    "mode": "synthetic",
    "pair_id": "aa0_2",
    "pair_order": 1,
    "schema_version": "1.1",
    "side": "right",
    "target_id": "block"
  },
  {
    "block": 3,
    "control_sha256": "7da89ea4bb10be9daaafde07a482782d650c91b1f817cd9f7b1b6f0706f2ca47",
    "elapsed_ms": 100,
    "label": "block",
    "masked_side": "y",
    "mode": "synthetic",
    "pair_id": "aa0_3",
    "pair_order": 0,
    "schema_version": "1.1",
    "side": "right",
    "target_id": "block"
  },
  {
    "block": 3,
    "control_sha256": "7da89ea4bb10be9daaafde07a482782d650c91b1f817cd9f7b1b6f0706f2ca47",
    "elapsed_ms": 100,
    "label": "block",
    "masked_side": "x",
    "mode": "synthetic",
    "pair_id": "aa0_3",
    "pair_order": 1,
    "schema_version": "1.1",
    "side": "left",
    "target_id": "block"
  },
  {
    "block": 0,
    "control_sha256": "7da89ea4bb10be9daaafde07a482782d650c91b1f817cd9f7b1b6f0706f2ca47",
    "elapsed_ms": 100,
    "label": "captcha",
    "masked_side": "x",
    "mode": "synthetic",
    "pair_id": "aa1_0",
    "pair_order": 0,
    "schema_version": "1.1",
    "side": "left",
    "target_id": "captcha"
  },
  {
    "block": 0,
    "control_sha256": "7da89ea4bb10be9daaafde07a482782d650c91b1f817cd9f7b1b6f0706f2ca47",
    "elapsed_ms": 100,
    "label": "captcha",
    "masked_side": "y",
    "mode": "synthetic",
    "pair_id": "aa1_0",
    "pair_order": 1,
    "schema_version": "1.1",
    "side": "right",
    "target_id": "captcha"
  },
  {
    "block": 1,
    "control_sha256": "7da89ea4bb10be9daaafde07a482782d650c91b1f817cd9f7b1b6f0706f2ca47",
    "elapsed_ms": 100,
    "label": "captcha",
    "masked_side": "y",
    "mode": "synthetic",
    "pair_id": "aa1_1",
    "pair_order": 0,
    "schema_version": "1.1",
    "side": "right",
    "target_id": "captcha"
  },
  {
    "block": 1,
    "control_sha256": "7da89ea4bb10be9daaafde07a482782d650c91b1f817cd9f7b1b6f0706f2ca47",
    "elapsed_ms": 100,
    "label": "captcha",
    "masked_side": "x",
    "mode": "synthetic",
    "pair_id": "aa1_1",
    "pair_order": 1,
    "schema_version": "1.1",
    "side": "left",
    "target_id": "captcha"
  },
  {
    "block": 2,
    "control_sha256": "7da89ea4bb10be9daaafde07a482782d650c91b1f817cd9f7b1b6f0706f2ca47",
    "elapsed_ms": 100,
    "label": "captcha",
    "masked_side": "x",
    "mode": "synthetic",
    "pair_id": "aa1_2",
    "pair_order": 0,
    "schema_version": "1.1",
    "side": "left",
    "target_id": "captcha"
  },
  {
    "block": 2,
    "control_sha256": "7da89ea4bb10be9daaafde07a482782d650c91b1f817cd9f7b1b6f0706f2ca47",
    "elapsed_ms": 100,
    "label": "captcha",
    "masked_side": "y",
    "mode": "synthetic",
    "pair_id": "aa1_2",
    "pair_order": 1,
    "schema_version": "1.1",
    "side": "right",
    "target_id": "captcha"
  },
  {
    "block": 3,
    "control_sha256": "7da89ea4bb10be9daaafde07a482782d650c91b1f817cd9f7b1b6f0706f2ca47",
    "elapsed_ms": 100,
    "label": "captcha",
    "masked_side": "y",
    "mode": "synthetic",
    "pair_id": "aa1_3",
    "pair_order": 0,
    "schema_version": "1.1",
    "side": "right",
    "target_id": "captcha"
  },
  {
    "block": 3,
    "control_sha256": "7da89ea4bb10be9daaafde07a482782d650c91b1f817cd9f7b1b6f0706f2ca47",
    "elapsed_ms": 100,
    "label": "captcha",
    "masked_side": "x",
    "mode": "synthetic",
    "pair_id": "aa1_3",
    "pair_order": 1,
    "schema_version": "1.1",
    "side": "left",
    "target_id": "captcha"
  },
  {
    "block": 0,
    "control_sha256": "7da89ea4bb10be9daaafde07a482782d650c91b1f817cd9f7b1b6f0706f2ca47",
    "elapsed_ms": 100,
    "label": "challenge",
    "masked_side": "y",
    "mode": "synthetic",
    "pair_id": "aa2_0",
    "pair_order": 0,
    "schema_version": "1.1",
    "side": "right",
    "target_id": "challenge"
  },
  {
    "block": 0,
    "control_sha256": "7da89ea4bb10be9daaafde07a482782d650c91b1f817cd9f7b1b6f0706f2ca47",
    "elapsed_ms": 100,
    "label": "challenge",
    "masked_side": "x",
    "mode": "synthetic",
    "pair_id": "aa2_0",
    "pair_order": 1,
    "schema_version": "1.1",
    "side": "left",
    "target_id": "challenge"
  },
  {
    "block": 1,
    "control_sha256": "7da89ea4bb10be9daaafde07a482782d650c91b1f817cd9f7b1b6f0706f2ca47",
    "elapsed_ms": 100,
    "label": "challenge",
    "masked_side": "x",
    "mode": "synthetic",
    "pair_id": "aa2_1",
    "pair_order": 0,
    "schema_version": "1.1",
    "side": "left",
    "target_id": "challenge"
  },
  {
    "block": 1,
    "control_sha256": "7da89ea4bb10be9daaafde07a482782d650c91b1f817cd9f7b1b6f0706f2ca47",
    "elapsed_ms": 100,
    "label": "challenge",
    "masked_side": "y",
    "mode": "synthetic",
    "pair_id": "aa2_1",
    "pair_order": 1,
    "schema_version": "1.1",
    "side": "right",
    "target_id": "challenge"
  },
  {
    "block": 2,
    "control_sha256": "7da89ea4bb10be9daaafde07a482782d650c91b1f817cd9f7b1b6f0706f2ca47",
    "elapsed_ms": 100,
    "label": "challenge",
    "masked_side": "y",
    "mode": "synthetic",
    "pair_id": "aa2_2",
    "pair_order": 0,
    "schema_version": "1.1",
    "side": "right",
    "target_id": "challenge"
  },
  {
    "block": 2,
    "control_sha256": "7da89ea4bb10be9daaafde07a482782d650c91b1f817cd9f7b1b6f0706f2ca47",
    "elapsed_ms": 100,
    "label": "challenge",
    "masked_side": "x",
    "mode": "synthetic",
    "pair_id": "aa2_2",
    "pair_order": 1,
    "schema_version": "1.1",
    "side": "left",
    "target_id": "challenge"
  },
  {
    "block": 3,
    "control_sha256": "7da89ea4bb10be9daaafde07a482782d650c91b1f817cd9f7b1b6f0706f2ca47",
    "elapsed_ms": 100,
    "label": "challenge",
    "masked_side": "x",
    "mode": "synthetic",
    "pair_id": "aa2_3",
    "pair_order": 0,
    "schema_version": "1.1",
    "side": "left",
    "target_id": "challenge"
  },
  {
    "block": 3,
    "control_sha256": "7da89ea4bb10be9daaafde07a482782d650c91b1f817cd9f7b1b6f0706f2ca47",
    "elapsed_ms": 100,
    "label": "challenge",
    "masked_side": "y",
    "mode": "synthetic",
    "pair_id": "aa2_3",
    "pair_order": 1,
    "schema_version": "1.1",
    "side": "right",
    "target_id": "challenge"
  },
  {
    "block": 0,
    "control_sha256": "7da89ea4bb10be9daaafde07a482782d650c91b1f817cd9f7b1b6f0706f2ca47",
    "elapsed_ms": 100,
    "label": "incomplete",
    "masked_side": "x",
    "mode": "synthetic",
    "pair_id": "aa3_0",
    "pair_order": 0,
    "schema_version": "1.1",
    "side": "left",
    "target_id": "download"
  },
  {
    "block": 0,
    "control_sha256": "7da89ea4bb10be9daaafde07a482782d650c91b1f817cd9f7b1b6f0706f2ca47",
    "elapsed_ms": 100,
    "label": "incomplete",
    "masked_side": "y",
    "mode": "synthetic",
    "pair_id": "aa3_0",
    "pair_order": 1,
    "schema_version": "1.1",
    "side": "right",
    "target_id": "download"
  },
  {
    "block": 1,
    "control_sha256": "7da89ea4bb10be9daaafde07a482782d650c91b1f817cd9f7b1b6f0706f2ca47",
    "elapsed_ms": 100,
    "label": "incomplete",
    "masked_side": "y",
    "mode": "synthetic",
    "pair_id": "aa3_1",
    "pair_order": 0,
    "schema_version": "1.1",
    "side": "right",
    "target_id": "download"
  },
  {
    "block": 1,
    "control_sha256": "7da89ea4bb10be9daaafde07a482782d650c91b1f817cd9f7b1b6f0706f2ca47",
    "elapsed_ms": 100,
    "label": "incomplete",
    "masked_side": "x",
    "mode": "synthetic",
    "pair_id": "aa3_1",
    "pair_order": 1,
    "schema_version": "1.1",
    "side": "left",
    "target_id": "download"
  },
  {
    "block": 2,
    "control_sha256": "7da89ea4bb10be9daaafde07a482782d650c91b1f817cd9f7b1b6f0706f2ca47",
    "elapsed_ms": 100,
    "label": "incomplete",
    "masked_side": "x",
    "mode": "synthetic",
    "pair_id": "aa3_2",
    "pair_order": 0,
    "schema_version": "1.1",
    "side": "left",
    "target_id": "download"
  },
  {
    "block": 2,
    "control_sha256": "7da89ea4bb10be9daaafde07a482782d650c91b1f817cd9f7b1b6f0706f2ca47",
    "elapsed_ms": 100,
    "label": "incomplete",
    "masked_side": "y",
    "mode": "synthetic",
    "pair_id": "aa3_2",
    "pair_order": 1,
    "schema_version": "1.1",
    "side": "right",
    "target_id": "download"